{
  "schema": "thoth-mem.benchmark-report.v1",
  "created_at": "1970-01-01T00:00:00.000Z",
  "dataset": {
    "name": "committed-fixture",
    "version": "1",
    "license": "committed-fixture",
    "availability": "committed",
    "corpus_hash": "515198eb6c02d617dc0d67224ef08568a86351891b5698c6a4102fbf3f964cdf",
    "query_hash": "521179b84f4c19d8022a981a3fc7c101ff50641b32e86e882aa3716b76a3cf42"
  },
  "candidate": {
    "id": "fixture-lexical",
    "config_hash": "708be68be3370505e47bebaef8bcdbb87953a9d34320114f69f47be4ce5111cc",
    "config": {
      "lexical": true
    }
  },
  "conditions": {
    "run_config_hash": "2e75eca360cdf3425f443c8013a67bd1dee51a513683b242dc19bc52ed7bee31",
    "query_order_hash": "8d2d7ac5a1fad29cd9421c5a5d36b24f65388512e1ce57b2e2755e5f10f37cec",
    "reader": {
      "id": "fixture-reader@1",
      "settings_hash": "f99af363b3af5aaa5aa871a7ad601986c18adf30f630503a9d1f8b4d0775b968"
    },
    "scorer": {
      "id": "deterministic-exact@1",
      "settings_hash": "da5fef92dbeb24a39d8ec046b85f159d529ed49c386c7941ff6bcb752ffa1070"
    },
    "seed": 7,
    "timeout_ms": 10000,
    "retries": 0
  },
  "environment": {
    "runtime": "node",
    "runtime_version": "24.21.0",
    "platform": "win32",
    "arch": "x64"
  },
  "budgets": {
    "candidate_k": 5,
    "context_tokens": 1000,
    "final_context_code_points": 1000
  },
  "primary_metrics": [
    {
      "namespace": "retrieval",
      "metric": "mrr",
      "gate": "relative_gain",
      "threshold": 0.05
    },
    {
      "namespace": "retrieval",
      "metric": "recall_at_1",
      "gate": "non_regression"
    },
    {
      "namespace": "retrieval",
      "metric": "recall_at_5",
      "gate": "non_regression"
    },
    {
      "namespace": "retrieval",
      "metric": "hit_at_k",
      "gate": "non_regression"
    },
    {
      "namespace": "answer",
      "metric": "exact_match",
      "gate": "non_regression"
    },
    {
      "namespace": "agent",
      "metric": "hidden_test_success",
      "gate": "non_regression"
    }
  ],
  "promotion_gate": {
    "provenance_coverage": 1,
    "resource_ceilings": {
      "latency_p95_ms": 1.25,
      "peak_memory_bytes": 1.1,
      "database_bytes": 1.25,
      "model_bytes": 1,
      "network_calls": 1,
      "llm_calls": 1,
      "injected_tokens": 1
    }
  },
  "metrics": {
    "retrieval": {
      "mrr": 1,
      "recall_at_1": 1,
      "recall_at_5": 1,
      "hit_at_k": 1
    },
    "evidence": {
      "recall": 1,
      "provenance_coverage": 1
    },
    "answer": {
      "exact_match": 1
    },
    "agent": {
      "hidden_test_success": null
    },
    "progressive": {
      "compact_returned_chars": 23,
      "context_returned_chars": 23,
      "source_chars": 23,
      "evidence_chars": 23,
      "full_chars": 23,
      "truncated_chars": 0,
      "full_fetches": 1,
      "avoided_full_fetches": 0,
      "escalation_rate": 1,
      "compression_ratio": 1
    },
    "compaction": {
      "checkpoints": 1,
      "recoveries": 2,
      "recovery_success": 2,
      "delivered_sources": 4
    },
    "continuity": {
      "actionable_field_names": [
        "Objective",
        "Completed",
        "First pending action",
        "Blockers",
        "Key files/checks"
      ],
      "actionable_fields_expected": 5,
      "actionable_fields_recovered": 5,
      "hidden_markers_expected": 3,
      "hidden_markers_recovered": 3,
      "restart_recovery_success": 1,
      "post_compaction_recovery_success": 1,
      "abstention_success": 1,
      "project_isolation_success": 1,
      "delegated_rejection_success": 1,
      "trust_boundary_present": 1,
      "poisoned_memory_safe": 1,
      "host_cap_compliance": 1,
      "evidence_ids_exposed": 0,
      "injected_code_points": 985,
      "injected_tokens": 247,
      "useful_content_code_points": 584,
      "useful_content_ratio": 0.6985645933014354,
      "selected_memory_ids": [
        "c2c5fdf5-d9c3-54f8-a8eb-d400cbcf6228",
        "f879eb2b-7920-5efb-a921-de8e99202659"
      ]
    },
    "summary": {
      "ordered_idempotency": 1,
      "supported_claims": 1,
      "unsupported_claims": 0,
      "cross_scope_rejection": 1,
      "version_precedence": 1,
      "no_auto_promotion": 1,
      "promoted_handoffs": 0,
      "checkpoint_content_events_expected": 3,
      "checkpoint_content_events_recorded": 3,
      "host_recoveries_expected": 3,
      "three_host_recovery": 3,
      "support_leakage": 0,
      "actionable_field_names": [
        "Objective",
        "Completed",
        "First pending action",
        "Blockers",
        "Key files/checks"
      ],
      "actionable_fields_expected": 5,
      "control_actionable_fields_recovered": 5,
      "candidate_actionable_fields_recovered": 5,
      "control_injected_code_points": 2302,
      "candidate_injected_code_points": 2032,
      "control_useful_content_code_points": 869,
      "candidate_useful_content_code_points": 869,
      "baseline_useful_content_ratio": 0.37749782797567333,
      "summary_useful_content_ratio": 0.42765748031496065,
      "useful_content_non_inferiority": 1,
      "control_selected_memory_ids": [
        "f92eaa64-8087-588a-a4c8-6e7fe45a80d0",
        "8f2936fa-b9fb-5df8-ae16-5ab0dd7a6b78",
        "8414b4c7-d163-548d-a89a-aa9053593204"
      ],
      "candidate_selected_summary_ids": [
        "7f86b751-398e-5147-a6f3-2767f5019766",
        "9178b2ac-8c36-5988-abe4-7900071ad19f",
        "a2957ae5-b393-52bd-a57f-523936dc3a40"
      ],
      "candidate_selected_memory_ids": [],
      "model_calls": 0,
      "network_calls": 0
    },
    "resources": {
      "latency_p50_ms": 1.5032999999999674,
      "latency_p95_ms": 5.139999999999986,
      "ingestion_ms": 3.301899999999989,
      "startup_ms": 291.8199,
      "peak_memory_bytes": 98033664,
      "database_bytes": 450560,
      "model_bytes": 0,
      "network_calls": 0,
      "llm_calls": 0,
      "injected_tokens": 247,
      "returned_chars": 23,
      "truncated_chars": 0,
      "samples": {
        "latency_ms": [
          5.139999999999986,
          1.3050999999999817,
          1.5032999999999674,
          1.372199999999964,
          1.5871000000000208,
          1.416499999999985,
          1.5144999999999982
        ],
        "memory_bytes": [
          97562624,
          97644544,
          97722368,
          97783808,
          97824768,
          97939456,
          98033664
        ]
      }
    }
  },
  "provenance": {
    "coverage": 1,
    "source_ids": [
      "f879eb2b-7920-5efb-a921-de8e99202659",
      "414edb10-f3cd-5d25-a8ad-66d42ff4e67d",
      "c2c5fdf5-d9c3-54f8-a8eb-d400cbcf6228",
      "5267a981-13c2-557a-a27a-9c46c23eef9c",
      "f92eaa64-8087-588a-a4c8-6e7fe45a80d0",
      "8f2936fa-b9fb-5df8-ae16-5ab0dd7a6b78",
      "8414b4c7-d163-548d-a89a-aa9053593204",
      "7f86b751-398e-5147-a6f3-2767f5019766",
      "9178b2ac-8c36-5988-abe4-7900071ad19f",
      "a2957ae5-b393-52bd-a57f-523936dc3a40"
    ]
  },
  "fallback_controls": [
    {
      "scenario": "disabled",
      "observed_state": "disabled",
      "control_lexical_hits": 1,
      "fallback_lexical_hits": 1,
      "source_ids": [
        "f879eb2b-7920-5efb-a921-de8e99202659",
        "414edb10-f3cd-5d25-a8ad-66d42ff4e67d"
      ]
    },
    {
      "scenario": "missing",
      "observed_state": "missing",
      "control_lexical_hits": 1,
      "fallback_lexical_hits": 1,
      "source_ids": [
        "f879eb2b-7920-5efb-a921-de8e99202659",
        "414edb10-f3cd-5d25-a8ad-66d42ff4e67d"
      ]
    },
    {
      "scenario": "stale",
      "observed_state": "stale",
      "control_lexical_hits": 1,
      "fallback_lexical_hits": 1,
      "source_ids": [
        "f879eb2b-7920-5efb-a921-de8e99202659",
        "414edb10-f3cd-5d25-a8ad-66d42ff4e67d"
      ]
    },
    {
      "scenario": "rebuilding",
      "observed_state": "rebuilding",
      "control_lexical_hits": 1,
      "fallback_lexical_hits": 1,
      "source_ids": [
        "f879eb2b-7920-5efb-a921-de8e99202659",
        "414edb10-f3cd-5d25-a8ad-66d42ff4e67d"
      ]
    },
    {
      "scenario": "failed",
      "observed_state": "degraded",
      "control_lexical_hits": 1,
      "fallback_lexical_hits": 1,
      "source_ids": [
        "f879eb2b-7920-5efb-a921-de8e99202659",
        "414edb10-f3cd-5d25-a8ad-66d42ff4e67d"
      ]
    },
    {
      "scenario": "source_mismatched",
      "observed_state": "stale",
      "control_lexical_hits": 1,
      "fallback_lexical_hits": 1,
      "source_ids": [
        "f879eb2b-7920-5efb-a921-de8e99202659",
        "414edb10-f3cd-5d25-a8ad-66d42ff4e67d"
      ]
    }
  ],
  "operational_errors": [
    {
      "operation": "optional_projection",
      "code": "projection_failed",
      "message": "Optional projection unavailable; lexical fallback remained active.",
      "retryable": true
    }
  ],
  "unavailable": [
    {
      "id": "longmemeval-s",
      "reason": "dataset_not_prepared"
    },
    {
      "id": "locomo",
      "reason": "dataset_not_prepared"
    },
    {
      "id": "amb-beam-100k",
      "reason": "runner_not_prepared"
    },
    {
      "id": "amb-beam-1m",
      "reason": "runner_not_prepared"
    },
    {
      "id": "amb-personamem-32k",
      "reason": "runner_not_prepared"
    },
    {
      "id": "amb-personamem-1m",
      "reason": "runner_not_prepared"
    },
    {
      "id": "sdebench",
      "reason": "hidden_runner_not_prepared"
    }
  ],
  "promotion": {
    "decision": "incomplete",
    "reasons": [
      "fixture_only_external_lanes_unavailable"
    ]
  },
  "observation_pipeline": {
    "schema": "thoth-mem.observation-pipeline-report.v1",
    "created_at": "1970-01-01T00:00:00.000Z",
    "conditions": {
      "seed": 17,
      "sample_count": 31,
      "top_k": 5,
      "budget_chars": 1000,
      "query": "local SQLite memory core",
      "model_calls": 0,
      "network_calls": 0
    },
    "control": {